quantity,review,fname,orderid
3,Vegetable fried rice is more attractive,Vegetable fried rice,681
11,Bakso is then functional,Bakso,682
1,Bhajji is greatly rude,Bhajji,682
2,Coconut milk curry is only short,Coconut milk curry,682
2,Noodles is also plant,Noodles,682
1,Mole is cheerfully descriptive,Mole,682
2,Cha ca is eagerly endurable,Cha ca,682
9,Gogigui is excitedly cooperative,Gogigui,683
2,Natto is briskly ragged,Natto,683
8,Ossobuco is helplessly new,Ossobuco,683
4,Sundubu jjigae is sedately demonic,Sundubu jjigae,683
4,Tom yum goong is joyously spiffy,Tom yum goong,683
10,Bhajji is tensely deep,Bhajji,683
4,Beef rendang is virtually tired,Beef rendang,683
2,Goi cuon is successfully sorry,Goi cuon,683
9,Palak paneer is vivaciously robust,Palak paneer,684
3,Kimchi stew is fairly flowery,Kimchi stew,684
1,Chicken wings is directly sick,Chicken wings,684
6,Bak chor mee is unbearably stiff,Bak chor mee,684
6,Soto is knottily jobless,Soto,684
1,Pork bulgogi is thus like,Pork bulgogi,685
7,Szechwan chilli chicken is dramatically dreary,Szechwan chilli chicken,685
1,Polenta is calmly loving,Polenta,685
1,Vegetable fried rice is fiercely normal,Vegetable fried rice,685
1,Kimchi is tightly synonymous,Kimchi,685
8,Bakso is courageously equable,Bakso,686
1,Bhajji is smoothly slim,Bhajji,686
1,Mole is excitedly spooky,Mole,686
1,Cha ca is lively free,Cha ca,686
10,Mole is not bitter,Mole,687
3,Bak chor mee is willfully plant,Bak chor mee,687
2,Polenta is frantically sturdy,Polenta,687
6,Sushi is else broad,Sushi,687
1,Gogigui is utterly consistent,Gogigui,687
3,Cao lau is fast lucky,Cao lau,687
2,Chicken wings is limply kind,Chicken wings,687
10,Spaghetti Aglio Olio is personally political,Spaghetti Aglio Olio,687
1,Papdi chaat is broadly slimy,Papdi chaat,687
1,Tempura is widely slim,Tempura,688
1,Stir fried tofu with rice is terribly shaky,Stir fried tofu with rice,688
5,Hot and sour soup is noisily vast,Hot and sour soup,688
2,Tofu is knottily womanly,Tofu,688
2,Bak chor mee is inquisitively overrated,Bak chor mee,688
3,Kaya toast is therefore lame,Kaya toast,688
1,Chicken rice is unfortunately imperfect,Chicken rice,688
2,Dim sum is greedily rude,Dim sum,688
4,Chocolate chip cookie is coolly scared,Chocolate chip cookie,689
1,Enchiladas is shyly zealous,Enchiladas,689
7,Thai hanglay curry is fatally sturdy,Thai hanglay curry,689
1,Tostadas is often synonymous,Tostadas,689
1,Pozole is officially elated,Pozole,689
4,Ayam goreng is openly creepy,Ayam goreng,689
3,Natto is fervently necessary,Natto,689
4,Korma is primarily secretive,Korma,690
9,Samgyeopsal is tomorrow synonymous,Samgyeopsal,690
2,Tom yum goong is offensively tart,Tom yum goong,690
2,Beef rendang is mechanically political,Beef rendang,691
5,Pho is specifically robust,Pho,691
2,Chicken tikka masala is successfully confident,Chicken tikka masala,691
10,Kimchi stew is yawningly somber,Kimchi stew,691
7,Laksa is queerly dangerous,Laksa,692
3,Soba is intently freezing,Soba,692
2,Donburi is sharply psychedelic,Donburi,692
1,Macaroni and Cheese is politely various,Macaroni and Cheese,692
4,Soto is easily superb,Soto,692
9,Chocolate chip cookie is essentially nonchalant,Chocolate chip cookie,693
2,Oyster omelette is possibly realistic,Oyster omelette,693
1,Beef rendang is anyway wiry,Beef rendang,693
6,Bak chor mee is eagerly upbeat,Bak chor mee,693
4,Banh khot is hungrily repulsive,Banh khot,693
4,Fish stew is sleepily jumpy,Fish stew,694
1,Kimchi is instead fertile,Kimchi,694
1,Ayam goreng is dreamily gaping,Ayam goreng,694
2,Noodles is valiantly quiet,Noodles,694
5,Murg makhani is enormously aboriginal,Murg makhani,694
3,Cao lau is bleakly weak,Cao lau,695
2,Ramen is hastily alluring,Ramen,695
4,Fried chicken is willfully deep,Fried chicken,695
4,Boiled vegetable soup is obediently consistent,Boiled vegetable soup,695
1,Rawon is sleepily lucky,Rawon,695
1,Bun bo hue is rarely flowery,Bun bo hue,695
2,Chicken rice is awkwardly superb,Chicken rice,696
3,Ayam penyet is vivaciously general,Ayam penyet,696
1,Palak paneer is helplessly superb,Palak paneer,696
1,Nem ran is thoughtfully wide,Nem ran,696
7,Spring rolls is doubtfully wretched,Spring rolls,696
1,Soto is quarrelsomely grieving,Soto,697
4,Tom yum goong is madly somber,Tom yum goong,697
1,Sate is potentially somber,Sate,698
2,Ayam penyet is upright waiting,Ayam penyet,698
1,Kimchi stew is mechanically grubby,Kimchi stew,698
5,Natto is irritably gaping,Natto,698
2,Chilaquiles is therefore wasteful,Chilaquiles,699
3,Thai hanglay curry is loudly noxious,Thai hanglay curry,699
1,Apple pie is interestingly intelligent,Apple pie,699
8,Fried chicken is deceivingly mushy,Fried chicken,700
4,Stir fried tofu with rice is awkwardly dramatic,Stir fried tofu with rice,700
2,Bottarga is merrily auspicious,Bottarga,700
1,Bakso is enormously political,Bakso,700
1,Tempura is strictly foolish,Tempura,700
1,Doughnut is utterly grieving,Doughnut,700
1,Tacos al pastor is courageously gusty,Tacos al pastor,701
1,Mole is dreamily bright,Mole,701
3,Polenta is regularly painful,Polenta,702
4,Lasagna is daintily dynamic,Lasagna,702
1,Enchiladas is warmly quiet,Enchiladas,702
1,Macaroni and Cheese is anyway shiny,Macaroni and Cheese,703
5,Bun bo hue is hopelessly endurable,Bun bo hue,703
4,Fish stew is wetly shut,Fish stew,703
2,Curry fish head is likely gentle,Curry fish head,703
7,Fried carrot cake is anxiously intelligent,Fried carrot cake,703
5,Sichuan pork is hungrily tan,Sichuan pork,704
2,Pizza is jovially adjoining,Pizza,704
2,Bak chor mee is merrily disgusted,Bak chor mee,704
5,Soto is daintily disgusted,Soto,704
2,Bakso is wildly serious,Bakso,704
4,Dim sum is thankfully daffy,Dim sum,704
6,Sour soup is effectively special,Sour soup,705
4,Dim sum is shrilly spiteful,Dim sum,705
9,Hash browns is queerly itchy,Hash browns,705
4,Cantonese chicken soup is greedily grubby,Cantonese chicken soup,705
4,Donburi is unaccountably wide,Donburi,705
1,Boiled vegetable soup is effectively merciful,Boiled vegetable soup,705
8,Gado gado is questioningly evasive,Gado gado,706
3,Udon is quarrelsomely wretched,Udon,706
3,Pozole is yieldingly gabby,Pozole,707
1,Bak chor mee is interestingly scandalous,Bak chor mee,707
5,Soto is closely annoying,Soto,707
5,Banh xeo is frightfully kaput,Banh xeo,707
2,Spring rolls is rarely cultured,Spring rolls,707
1,Kaya toast is enormously daffy,Kaya toast,707
8,Pho is sternly skillful,Pho,707
3,Tofu is hourly glamorous,Tofu,708
7,Kimchi stew is immediately wiry,Kimchi stew,708
4,Chicken tikka masala is hungrily defeated,Chicken tikka masala,708
1,Palak paneer is literally dirty,Palak paneer,708
8,Sashimi is accidentally jobless,Sashimi,708
2,Tempura is happily smiling,Tempura,709
4,Rawon is healthily small,Rawon,709
2,Coconut milk curry is noisily mundane,Coconut milk curry,709
6,Cantonese chicken soup is rigidly decent,Cantonese chicken soup,709
1,Thai hanglay curry is justly vacuous,Thai hanglay curry,710
3,Ayam penyet is seldom expensive,Ayam penyet,710
1,Sour soup is justly wide,Sour soup,710
2,Banh khot is already loving,Banh khot,710
1,Fish stew is yieldingly smiling,Fish stew,710
5,Cantonese chicken soup is frequently bumpy,Cantonese chicken soup,711
1,Pork bulgogi is frantically threatening,Pork bulgogi,711
1,Goi cuon is zestfully synonymous,Goi cuon,711
7,Tom yum goong is zealously therapeutic,Tom yum goong,711
2,Fish kidney curry is accidentally freezing,Fish kidney curry,711
1,Apple pie is seldom sorry,Apple pie,711
4,Chiles en nogada is obediently true,Chiles en nogada,711
2,Nem ran is unabashedly upbeat,Nem ran,711
1,Stir fried tofu with rice is badly sexual,Stir fried tofu with rice,711
1,Noodles is healthily colossal,Noodles,712
1,Cha ca is quarrelsomely smiling,Cha ca,712
1,Ramyeon is tediously wide,Ramyeon,712
2,Kimchi is joyously cloudy,Kimchi,712
4,Risotto is fast itchy,Risotto,712
6,Soto is kissingly changeable,Soto,712
4,Szechwan chilli chicken is solidly tacit,Szechwan chilli chicken,713
3,Palak paneer is twice mean,Palak paneer,713
4,Bak kut teh is currently friendly,Bak kut teh,713
1,Coconut milk curry is however several,Coconut milk curry,713
1,Bibimbap is dearly unfair,Bibimbap,714
3,Dim sum is less wrathful,Dim sum,714
1,Pizza is mysteriously round,Pizza,715
5,Cheeseburger is irritably wicked,Cheeseburger,715
8,Mole is suddenly wonderful,Mole,715
8,Tandoori chicken is easily serious,Tandoori chicken,715
1,Natto is loyally psychedelic,Natto,715
2,Palak paneer is soon rude,Palak paneer,716
3,Tostadas is seemingly puzzled,Tostadas,716
2,Murg makhani is bravely cooperative,Murg makhani,716
2,Coconut milk curry is shrilly ugly,Coconut milk curry,717
1,Murg makhani is also didactic,Murg makhani,717
1,Gogigui is safely grubby,Gogigui,717
1,Gado gado is knottily equable,Gado gado,717
1,Sundubu jjigae is cruelly plant,Sundubu jjigae,718
7,Chiles en nogada is again volatile,Chiles en nogada,718
5,Noodles is twice dapper,Noodles,718
1,Chicken wings is hardly spiffy,Chicken wings,718
8,Cheeseburger is especially free,Cheeseburger,718
1,Oyster omelette is promptly somber,Oyster omelette,718
1,Chicken tikka masala is thoroughly standing,Chicken tikka masala,718
3,Wanton mee is badly lucky,Wanton mee,718
2,Apple pie is dutifully adventurous,Apple pie,718
5,Mole is especially powerful,Mole,719
1,Green curry chicken is deftly alluring,Green curry chicken,720
2,Gado gado is occasionally cloudy,Gado gado,721
1,Hash browns is judgementally chief,Hash browns,721
1,Kaya toast is madly oval,Kaya toast,721
2,Chicken with chestnuts is restfully zealous,Chicken with chestnuts,721
4,Kimchi is definitely inconclusive,Kimchi,721
1,Cheeseburger is furiously grubby,Cheeseburger,721
1,Soba is overconfidently milky,Soba,721
2,Chicken wings is weakly dirty,Chicken wings,721
3,Chicken galangal soup is far yielding,Chicken galangal soup,721
1,Beef rendang is equally zealous,Beef rendang,721
8,Fried carrot cake is speedily realistic,Fried carrot cake,721
4,Spring rolls is relatively flat,Spring rolls,722
2,Bhajji is frantically adjoining,Bhajji,722
8,Isaan soup is shrilly small,Isaan soup,722
4,Apple pie is solidly equable,Apple pie,722
6,Rau muong is willfully dapper,Rau muong,722
4,Sashimi is foolishly foregoing,Sashimi,723
5,Chiles en nogada is solemnly special,Chiles en nogada,723
1,Boiled vegetable soup is highly abashed,Boiled vegetable soup,723
6,Sushi is generally fresh,Sushi,723
1,Pizza is dearly jaded,Pizza,724
7,Gado gado is coyly wretched,Gado gado,724
1,Ribollita is else savory,Ribollita,725
3,Cheeseburger is sleepily tangible,Cheeseburger,725
2,Tandoori chicken is majestically calm,Tandoori chicken,725
1,Sichuan pork is punctually cooperative,Sichuan pork,725
6,Spicy stir fried octopus is cruelly spiffy,Spicy stir fried octopus,725
1,Banh xeo is obediently mushy,Banh xeo,725
1,Szechwan chilli chicken is seldom upbeat,Szechwan chilli chicken,726
6,Spaghetti Bolognese is obediently sturdy,Spaghetti Bolognese,726
2,Kaya toast is bitterly fuzzy,Kaya toast,726
1,Hash browns is tensely super,Hash browns,726
1,Spaghetti Carbonara is foolishly disgusted,Spaghetti Carbonara,726
4,Sour soup is regularly ashamed,Sour soup,726
9,Bottarga is automatically somber,Bottarga,727
1,Wanton mee is hopelessly evasive,Wanton mee,727
1,Chicken wings is blissfully basic,Chicken wings,727
1,Spicy stir fried octopus is altogether foolish,Spicy stir fried octopus,727
1,Sate is nicely decent,Sate,727
3,Ga tan is lightly synonymous,Ga tan,727
2,Hash browns is forth rich,Hash browns,727
5,Noodles is solidly dull,Noodles,727
2,Tempura is foolishly asleep,Tempura,727
1,Spaghetti Aglio Olio is positively sick,Spaghetti Aglio Olio,728
3,Rujak cingur is bitterly wide,Rujak cingur,728
4,French fries is interestingly naive,French fries,728
8,Beef rendang is longingly staking,Beef rendang,728
4,Bhajji is dimly oval,Bhajji,728
7,Cha ca is far flowery,Cha ca,728
2,Fried carrot cake is softly mean,Fried carrot cake,728
1,Rau muong is quickly quirky,Rau muong,728
1,Bak chor mee is equally foregoing,Bak chor mee,728
7,Ramyeon is terrifically decent,Ramyeon,729
2,Bibimbap is helpfully grateful,Bibimbap,729
1,Donburi is kissingly daffy,Donburi,729
2,Bakso is upwardly equable,Bakso,729
2,Steak is innocently lyrical,Steak,729
2,Coconut milk curry is keenly embarrassed,Coconut milk curry,730
1,Bibimbap is speedily jumpy,Bibimbap,731
2,Tempura is kookily fresh,Tempura,731
4,Polenta is knavishly lame,Polenta,731
4,Macaroni and Cheese is significantly drunk,Macaroni and Cheese,731
1,Ayam goreng is commonly null,Ayam goreng,731
2,Ramen is stealthily dynamic,Ramen,731
1,Sichuan pork is foolishly willing,Sichuan pork,731
7,Rawon is courageously dizzy,Rawon,732
8,Spaghetti Aglio Olio is suspiciously attractive,Spaghetti Aglio Olio,732
4,Spring rolls is upliftingly flippant,Spring rolls,732
1,Spicy stir fried octopus is faithfully lucky,Spicy stir fried octopus,732
1,Nem ran is upbeat sable,Nem ran,732
1,Oyster omelette is then cultured,Oyster omelette,733
3,Ayam goreng is officially sturdy,Ayam goreng,733
5,Cantonese chicken soup is anxiously tight,Cantonese chicken soup,733
3,Risotto is jaggedly jobless,Risotto,733
3,Gado gado is gracefully calm,Gado gado,733
1,Pozole is monthly tender,Pozole,733
9,Hash browns is devotedly fixed,Hash browns,734
8,Kaya toast is restfully similar,Kaya toast,734
7,Goi cuon is knowledgeably deeply,Goi cuon,734
4,Papdi chaat is scarily evasive,Papdi chaat,734
10,Cheeseburger is hardly future,Cheeseburger,734
8,Korma is heavily yielding,Korma,735
2,Tempura is immediately defeated,Tempura,735
2,Sour soup is wetly dreary,Sour soup,735
4,Chicken rice is quicker adjoining,Chicken rice,735
9,Ramen is slowly wonderful,Ramen,735
2,Steak is arrogantly lucky,Steak,736
1,Cheeseburger is however naive,Cheeseburger,736
2,Tempura is needily ragged,Tempura,736
2,Bun bo hue is tremendously sorry,Bun bo hue,736
5,Hot and sour soup is tremendously unfair,Hot and sour soup,737
3,Ramyeon is frightfully auspicious,Ramyeon,737
4,Beef soup is partially thinkable,Beef soup,737
2,Ribollita is rightfully lopsided,Ribollita,738
2,Szechwan chilli chicken is very shocking,Szechwan chilli chicken,738
4,Rujak cingur is often null,Rujak cingur,738
1,Hot and sour soup is evenly stormy,Hot and sour soup,739
1,Cantonese chicken soup is utterly amused,Cantonese chicken soup,739
2,Chiles en nogada is reassuringly spotless,Chiles en nogada,739
3,Udon is fondly quick,Udon,739
4,Soba is ever defeated,Soba,739
8,Murg makhani is almost fine,Murg makhani,740
5,Chicken galangal soup is generously unsuitable,Chicken galangal soup,740
3,Tacos al pastor is deeply selective,Tacos al pastor,740
2,Boiled vegetable soup is colorfully nauseating,Boiled vegetable soup,740
5,Pizza is softly synonymous,Pizza,740
1,Ayam penyet is upwardly lush,Ayam penyet,740
8,Chicken wings is then equable,Chicken wings,741
8,Ribollita is mainly daffy,Ribollita,741
8,Chicken rice is weekly swanky,Chicken rice,741
8,Chole is specifically painful,Chole,741
1,Chiles en nogada is primarily jaded,Chiles en nogada,741
1,Chicken galangal soup is really asleep,Chicken galangal soup,742
8,Boiled vegetable soup is then dapper,Boiled vegetable soup,742
4,Bak kut teh is normally helpless,Bak kut teh,742
2,Curry fish head is mechanically classy,Curry fish head,742
2,Doughnut is recklessly political,Doughnut,743
1,Bhajji is upward zesty,Bhajji,743
1,Guacamole is keenly curved,Guacamole,743
2,Lasagna is devotedly tranquil,Lasagna,743
1,Soto is calmly somber,Soto,744
2,Isaan soup is swiftly madly,Isaan soup,744
5,Tofu is terribly homely,Tofu,744
6,Nasi goreng is fast alluring,Nasi goreng,744
3,Lasagna is sternly descriptive,Lasagna,744
1,Fish stew is promptly sudden,Fish stew,744
1,Bhajji is similarly madly,Bhajji,745
4,Tom yum goong is jaggedly married,Tom yum goong,745
7,Ayam goreng is elsewhere courageous,Ayam goreng,745
4,Chiles en nogada is dearly lucky,Chiles en nogada,745
2,Kimchi is forth imminent,Kimchi,745
2,Fried chicken is already quirky,Fried chicken,746
4,Pork bulgogi is more magical,Pork bulgogi,746
6,Ga tan is everywhere acidic,Ga tan,746
1,Chicken with chestnuts is fervently madly,Chicken with chestnuts,746
4,Soba is initially functional,Soba,747
6,Samgyeopsal is deeply innate,Samgyeopsal,748
2,Donburi is similarly childlike,Donburi,748
1,Murg makhani is overconfidently womanly,Murg makhani,748
2,Nem ran is intently special,Nem ran,748
3,Soba is doubtfully one,Soba,748
1,Donburi is however flowery,Donburi,749
2,Ayam penyet is suspiciously ragged,Ayam penyet,749
1,Naan is ever tender,Naan,749
2,Chicken tikka masala is usually blue-eyed,Chicken tikka masala,749
8,Rujak cingur is constantly stormy,Rujak cingur,749
4,Risotto is early scandalous,Risotto,750
6,Banh khot is reassuringly obsequious,Banh khot,750
1,Hokkien prawn mee is daintily normal,Hokkien prawn mee,750
1,Cantonese chicken soup is quarrelsomely educated,Cantonese chicken soup,751
4,Chicken galangal soup is hungrily attractive,Chicken galangal soup,751
2,Rawon is essentially expensive,Rawon,752
1,Fried carrot cake is crazily nauseating,Fried carrot cake,752
5,Ramyeon is unfortunately foregoing,Ramyeon,752
1,Pozole is suddenly sparkling,Pozole,752
1,Tandoori chicken is totally expensive,Tandoori chicken,752
1,Risotto is wetly evasive,Risotto,753
3,Beef rendang is wholly chief,Beef rendang,753
2,Ayam goreng is absentmindedly powerful,Ayam goreng,754
2,Gogigui is limply somber,Gogigui,754
2,Stir fried tofu with rice is upside-down staking,Stir fried tofu with rice,754
3,Rawon is excitedly temporary,Rawon,754
3,Tacos al pastor is reassuringly chief,Tacos al pastor,755
2,Ayam goreng is silently terrific,Ayam goreng,755
1,Kimchi is irritably fuzzy,Kimchi,755
4,Bun bo hue is delightfully bright,Bun bo hue,755
10,Tempura is daintily stiff,Tempura,755
7,Chicken rice is inquisitively black,Chicken rice,755
8,Kimchi stew is mostly certain,Kimchi stew,755
1,Chicken with chestnuts is vaguely tired,Chicken with chestnuts,755
3,Green curry chicken is loyally grieving,Green curry chicken,756
4,Cheeseburger is slowly clean,Cheeseburger,756
2,Bakso is already shut,Bakso,756
6,Cantonese chicken soup is acidly obtainable,Cantonese chicken soup,756
1,Pork bulgogi is uselessly fertile,Pork bulgogi,756
1,Nem ran is almost alluring,Nem ran,757
3,Chicken tikka masala is broadly delicate,Chicken tikka masala,757
7,Spaghetti Bolognese is vainly foreign,Spaghetti Bolognese,757
7,Beef rendang is together decent,Beef rendang,757
8,Chicken rice is sleepily fuzzy,Chicken rice,757
2,Spaghetti Aglio Olio is fortunately serious,Spaghetti Aglio Olio,757
3,Chicken galangal soup is never mountainous,Chicken galangal soup,757
2,Mole is patiently equable,Mole,759
8,Enchiladas is awkwardly meek,Enchiladas,759
3,French fries is energetically wicked,French fries,759
8,Chilaquiles is literally merciful,Chilaquiles,759
2,Bak chor mee is sheepishly dreary,Bak chor mee,759
4,Kaya toast is valiantly shut,Kaya toast,760
4,Pizza is fiercely amuck,Pizza,760
2,Cheeseburger is loudly automatic,Cheeseburger,760
8,Macaroni and Cheese is queasily spiteful,Macaroni and Cheese,760
4,Soba is kiddingly naive,Soba,760
2,Yakitori is wearily eastern,Yakitori,761
1,Spaghetti Bolognese is almost hysterical,Spaghetti Bolognese,761
4,Goi cuon is upright reflective,Goi cuon,762
3,Sour soup is solemnly one,Sour soup,762
4,Spaghetti Carbonara is ahead disgusted,Spaghetti Carbonara,762
9,Spaghetti Bolognese is obediently clean,Spaghetti Bolognese,762
1,Pho is normally traditional,Pho,762
2,Pho is rather spurious,Pho,763
1,Hokkien prawn mee is strictly foregoing,Hokkien prawn mee,763
2,French fries is wrongly brainy,French fries,763
4,Beef rendang is absentmindedly black,Beef rendang,763
6,Soba is helpfully jumpy,Soba,763
1,Kimchi stew is brightly female,Kimchi stew,764
1,Hokkien prawn mee is clearly basic,Hokkien prawn mee,764
1,Papdi chaat is daily sturdy,Papdi chaat,764
8,Paratha is joyously unfair,Paratha,764
5,Enchiladas is thoroughly womanly,Enchiladas,764
1,Elote is politely sable,Elote,764
4,Murg makhani is kindheartedly immediate,Murg makhani,765
1,Enchiladas is sheepishly sturdy,Enchiladas,765
4,Ossobuco is already makeshift,Ossobuco,765
1,Soto is openly yielding,Soto,765
9,Bhajji is sharply lush,Bhajji,766
1,Hash browns is dearly graceful,Hash browns,766
1,Yakitori is badly gusty,Yakitori,766
6,Samgyeopsal is merrily synonymous,Samgyeopsal,766
2,Bottarga is upbeat big,Bottarga,766
11,French fries is warmly staking,French fries,766
1,Hot and sour soup is especially dapper,Hot and sour soup,767
2,Ramyeon is potentially helpless,Ramyeon,767
3,Spicy stir fried octopus is primarily stiff,Spicy stir fried octopus,768
1,Palak paneer is strictly sudden,Palak paneer,768
2,Yakitori is carelessly mixed,Yakitori,768
1,Naan is very foregoing,Naan,768
1,Bibimbap is excitedly inconclusive,Bibimbap,769
1,Pozole is shrilly vivacious,Pozole,769
3,Elote is possibly cloudy,Elote,769
4,Ayam penyet is slightly vacuous,Ayam penyet,769
2,Tostadas is constantly fertile,Tostadas,769
2,Papdi chaat is automatically free,Papdi chaat,769
1,Kimchi stew is shrilly spooky,Kimchi stew,769
2,Donburi is tensely evasive,Donburi,769
4,Vegetable fried rice is mostly substantial,Vegetable fried rice,770
1,Green curry chicken is constantly aboriginal,Green curry chicken,770
2,Fried chicken is inwardly several,Fried chicken,770
6,Macaroni and Cheese is wearily tangible,Macaroni and Cheese,770
7,Bak kut teh is strictly near,Bak kut teh,770
1,Spring rolls is intensely dreary,Spring rolls,771
3,Bhajji is widely quick,Bhajji,771
2,Naan is virtually dependent,Naan,771
1,Ayam goreng is strongly nonchalant,Ayam goreng,771
2,Gogigui is anyway nonchalant,Gogigui,771
3,Elote is ferociously endurable,Elote,772
1,Bhajji is unimpressively bouncy,Bhajji,773
1,Beef rendang is irritably chief,Beef rendang,773
1,Hash browns is unnaturally jumpy,Hash browns,773
3,Samgyeopsal is triumphantly skillful,Samgyeopsal,773
1,Bottarga is frenetically instinctive,Bottarga,773
10,French fries is seriously painful,French fries,773
1,Ribollita is quietly deep,Ribollita,774
4,Spicy stir fried octopus is loftily flaky,Spicy stir fried octopus,774
8,Ramyeon is daintily bizarre,Ramyeon,774
1,Chole is strictly bright,Chole,774
2,Samgyeopsal is rightfully milky,Samgyeopsal,774
2,Pizza is justly flippant,Pizza,774
1,Spaghetti Carbonara is faithfully equable,Spaghetti Carbonara,775
6,Bun bo hue is briefly scandalous,Bun bo hue,775
2,Beef soup is yawningly bite-sized,Beef soup,775
3,Cao lau is frenetically waiting,Cao lau,775
1,Gado gado is freely spiky,Gado gado,775
1,Paratha is selfishly clean,Paratha,775
4,Cao lau is jealously vivacious,Cao lau,776
2,Beef soup is thankfully unsightly,Beef soup,776
2,Nasi goreng is upward decent,Nasi goreng,776
1,Tandoori chicken is offensively traditional,Tandoori chicken,777
4,Pho is greedily vacuous,Pho,777
1,Sundubu jjigae is softly weak,Sundubu jjigae,778
4,Macaroni and Cheese is politely sturdy,Macaroni and Cheese,778
4,Bhajji is specifically synonymous,Bhajji,778
4,Kimchi is normally classy,Kimchi,778
6,Elote is originally spiky,Elote,778
7,Ossobuco is mechanically hospitable,Ossobuco,778
1,Cantonese chicken soup is nicely bizarre,Cantonese chicken soup,778
2,Wanton mee is knavishly blue-eyed,Wanton mee,778
2,Samgyeopsal is properly hysterical,Samgyeopsal,779
2,Goi cuon is yieldingly pink,Goi cuon,779
1,Elote is similarly lazy,Elote,779
7,Ayam penyet is daintily tired,Ayam penyet,780
1,Goi cuon is arrogantly auspicious,Goi cuon,780
7,Fried chicken is calmly chief,Fried chicken,780
4,Tempura is violently dynamic,Tempura,780
9,Ramyeon is strictly green,Ramyeon,780
4,Tostadas is else upbeat,Tostadas,781
1,Fried chicken is somewhat lucky,Fried chicken,781
6,Rawon is technically milky,Rawon,781
1,Coconut milk curry is basically synonymous,Coconut milk curry,781
4,Bakso is jubilantly sturdy,Bakso,782
5,Hokkien prawn mee is boastfully yielding,Hokkien prawn mee,782
2,Enchiladas is absentmindedly troubled,Enchiladas,782
4,Sushi is ahead spurious,Sushi,783
1,Hot and sour soup is limply ugly,Hot and sour soup,783
1,Bakso is upwardly traditional,Bakso,783
4,Tacos al pastor is absentmindedly unarmed,Tacos al pastor,783
2,Elote is famously foregoing,Elote,783
4,Natto is lively repulsive,Natto,783
1,French fries is bleakly political,French fries,783
4,Chicken galangal soup is kindly small,Chicken galangal soup,783
1,Rujak cingur is surprisingly colossal,Rujak cingur,783
7,Thai hanglay curry is upliftingly drunk,Thai hanglay curry,784
1,Risotto is offensively future,Risotto,784
5,Laksa is questionably childlike,Laksa,784
1,Rau muong is wisely hospitable,Rau muong,784
7,Donburi is broadly short,Donburi,784
2,Tandoori chicken is coolly several,Tandoori chicken,784
1,Tempura is more elastic,Tempura,784
6,Cha ca is gleefully unique,Cha ca,785
2,Chicken wings is rigidly disgusted,Chicken wings,785
1,Natto is questioningly fresh,Natto,785
2,Guacamole is adventurously adventurous,Guacamole,785
5,Kaya toast is constantly various,Kaya toast,786
4,Paratha is hourly loutish,Paratha,786
3,Donburi is upwardly serious,Donburi,786
4,Natto is regularly threatening,Natto,787
3,Gado gado is twice ragged,Gado gado,788
1,Sundubu jjigae is rapidly rampant,Sundubu jjigae,789
1,Bibimbap is daintily foregoing,Bibimbap,789
8,Macaroni and Cheese is hastily educated,Macaroni and Cheese,789
4,Chicken tikka masala is searchingly quiet,Chicken tikka masala,789
5,Ga tan is ever therapeutic,Ga tan,789
6,Beef rendang is smoothly superb,Beef rendang,790
3,Rau muong is patiently tender,Rau muong,791
4,Nem ran is correctly waiting,Nem ran,791
1,Curry fish head is crazily sable,Curry fish head,791
4,Ribollita is joyfully jumpy,Ribollita,791
1,Isaan soup is arrogantly cumbersome,Isaan soup,791
2,Bibimbap is necessarily cloudy,Bibimbap,791
5,Kimchi stew is completely flippant,Kimchi stew,792
2,Tom yum goong is completely fine,Tom yum goong,792
5,Sushi is offensively deep,Sushi,792
4,Tamales is bleakly tired,Tamales,792
