quantity,review,fname,orderid
1,Rau muong is healthily waiting,Rau muong,2239
5,Wanton mee is queasily grieving,Wanton mee,2240
3,Samgyeopsal is officially normal,Samgyeopsal,2240
5,Tamales is generally rustic,Tamales,2240
1,Stir fried tofu with rice is kissingly synonymous,Stir fried tofu with rice,2240
9,Isaan soup is solidly spotless,Isaan soup,2240
3,Papdi chaat is keenly super,Papdi chaat,2241
1,Cao lau is triumphantly meaty,Cao lau,2241
2,Palak paneer is closely aquatic,Palak paneer,2241
4,Doughnut is occasionally blue-eyed,Doughnut,2241
5,Spicy stir fried octopus is probably disillusioned,Spicy stir fried octopus,2241
2,Dim sum is elegantly scary,Dim sum,2241
3,Guacamole is powerfully dependent,Guacamole,2241
2,Bottarga is calmly tan,Bottarga,2242
4,Thai hanglay curry is woefully plant,Thai hanglay curry,2242
2,Sundubu jjigae is mechanically hysterical,Sundubu jjigae,2242
3,Banh khot is terribly equable,Banh khot,2242
4,Spaghetti Bolognese is usefully makeshift,Spaghetti Bolognese,2243
1,Chicken with chestnuts is altogether zany,Chicken with chestnuts,2243
9,Macaroni and Cheese is overconfidently disgusted,Macaroni and Cheese,2243
1,Kimchi is not swanky,Kimchi,2244
4,Sundubu jjigae is owlishly political,Sundubu jjigae,2244
2,Hash browns is vivaciously auspicious,Hash browns,2244
5,Pozole is unabashedly actually,Pozole,2244
1,Hokkien prawn mee is keenly madly,Hokkien prawn mee,2244
8,Sashimi is crazily melodic,Sashimi,2244
2,Sashimi is wearily realistic,Sashimi,2245
1,Kimchi is dramatically unique,Kimchi,2245
6,Apple pie is openly competitive,Apple pie,2245
2,Green curry chicken is jaggedly drunk,Green curry chicken,2245
7,Ribollita is recently flowery,Ribollita,2246
2,Tempura is boldly flashy,Tempura,2246
2,Enchiladas is justly disgusting,Enchiladas,2246
5,Dim sum is less obese,Dim sum,2246
1,Chicken with chestnuts is irritably nervous,Chicken with chestnuts,2246
8,Stir fried tofu with rice is lightly foregoing,Stir fried tofu with rice,2246
6,Fish stew is sleepily dizzy,Fish stew,2246
7,Tacos al pastor is obnoxiously therapeutic,Tacos al pastor,2247
1,Fried chicken is less fertile,Fried chicken,2247
4,Pork bulgogi is basically cheap,Pork bulgogi,2247
2,Spaghetti Carbonara is continually gabby,Spaghetti Carbonara,2247
5,Udon is wrongly mushy,Udon,2247
6,Hash browns is instantly madly,Hash browns,2247
5,Soto is ahead fine,Soto,2248
2,Kaya toast is almost shiny,Kaya toast,2248
1,Apple pie is unimpressively attractive,Apple pie,2248
1,Nem ran is ultimately functional,Nem ran,2248
2,Ossobuco is joyously functional,Ossobuco,2248
1,Macaroni and Cheese is constantly cumbersome,Macaroni and Cheese,2249
1,Palak paneer is faithfully delicate,Palak paneer,2250
9,Cha ca is regularly damaged,Cha ca,2250
6,Ayam goreng is devotedly broad,Ayam goreng,2250
2,Korma is kissingly mountainous,Korma,2251
7,Boiled vegetable soup is suspiciously staking,Boiled vegetable soup,2251
7,Isaan soup is thankfully assorted,Isaan soup,2251
3,Tamales is roughly cloudy,Tamales,2251
5,Cheeseburger is nicely tender,Cheeseburger,2252
3,Pizza is hopelessly spiteful,Pizza,2252
6,Cha ca is scarcely quiet,Cha ca,2252
6,Kimchi is roughly frightened,Kimchi,2252
2,Chicken tikka masala is totally aquatic,Chicken tikka masala,2253
1,Fish kidney curry is rapidly sudden,Fish kidney curry,2253
2,Oyster omelette is too ugly,Oyster omelette,2253
7,Banh khot is commonly evasive,Banh khot,2253
1,Chilaquiles is steadily flippant,Chilaquiles,2253
1,Noodles is powerfully tart,Noodles,2253
2,Mole is badly synonymous,Mole,2254
2,Bhajji is elsewhere quick,Bhajji,2254
2,Fish kidney curry is helplessly general,Fish kidney curry,2254
1,Chiles en nogada is softly confident,Chiles en nogada,2254
1,Hokkien prawn mee is less true,Hokkien prawn mee,2254
6,Rujak cingur is warmly political,Rujak cingur,2254
7,Tostadas is softly faulty,Tostadas,2254
5,Mole is coyly poor,Mole,2255
6,Curry fish head is upward changeable,Curry fish head,2255
4,Ramyeon is obnoxiously jaded,Ramyeon,2255
3,Chocolate chip cookie is woefully evasive,Chocolate chip cookie,2255
3,Pozole is commonly wide,Pozole,2256
7,Nem ran is vacantly adjoining,Nem ran,2256
1,Nasi goreng is scarily curious,Nasi goreng,2256
1,Bottarga is unimpressively logical,Bottarga,2257
1,Curry fish head is broadly unruly,Curry fish head,2257
1,Soba is enormously demonic,Soba,2257
3,Elote is readily unique,Elote,2257
1,Laksa is fairly synonymous,Laksa,2257
3,Bhajji is far amused,Bhajji,2257
5,Hash browns is deftly frightened,Hash browns,2257
6,Murg makhani is annually brainy,Murg makhani,2257
1,Spicy stir fried octopus is mainly eastern,Spicy stir fried octopus,2257
2,Korma is generously unsightly,Korma,2257
3,Nem ran is coolly inconclusive,Nem ran,2257
6,Chilaquiles is commonly normal,Chilaquiles,2257
5,Chicken with chestnuts is upbeat ruddy,Chicken with chestnuts,2258
1,Rujak cingur is separately highfalutin,Rujak cingur,2258
1,Guacamole is oddly quiet,Guacamole,2258
1,Tamales is irritably sturdy,Tamales,2258
8,Samgyeopsal is then homely,Samgyeopsal,2259
3,Kimchi is openly spooky,Kimchi,2260
1,Curry fish head is poorly tan,Curry fish head,2260
4,Tempura is coaxingly purple,Tempura,2260
7,Spring rolls is wisely regular,Spring rolls,2260
2,Soba is uselessly clean,Soba,2260
1,Gado gado is regularly eastern,Gado gado,2261
1,Palak paneer is rather black,Palak paneer,2261
2,Polenta is cheerfully slim,Polenta,2261
3,Green curry chicken is sadly female,Green curry chicken,2261
3,Wanton mee is joshingly normal,Wanton mee,2261
4,Tom yum goong is smoothly powerful,Tom yum goong,2262
1,Beef rendang is speedily sturdy,Beef rendang,2262
2,Curry fish head is courageously wrathful,Curry fish head,2263
8,Bak chor mee is regularly magical,Bak chor mee,2263
3,Banh khot is strictly nauseating,Banh khot,2263
1,Tofu is zestily magical,Tofu,2264
10,Macaroni and Cheese is already glamorous,Macaroni and Cheese,2264
1,Coconut milk curry is recently wide,Coconut milk curry,2264
9,Fish stew is terribly normal,Fish stew,2264
5,Wanton mee is tensely deeply,Wanton mee,2265
4,Ayam goreng is quietly amused,Ayam goreng,2265
1,Cha ca is successfully dapper,Cha ca,2265
5,Spaghetti Carbonara is bitterly probable,Spaghetti Carbonara,2266
6,Cantonese chicken soup is famously vast,Cantonese chicken soup,2266
4,Mole is inquisitively swanky,Mole,2266
4,Spaghetti Bolognese is separately true,Spaghetti Bolognese,2267
1,Chicken rice is crazily wide-eyed,Chicken rice,2267
7,Ribollita is terribly political,Ribollita,2267
2,Sundubu jjigae is ultimately descriptive,Sundubu jjigae,2267
3,Noodles is regularly basic,Noodles,2267
3,Fried carrot cake is zestfully psychedelic,Fried carrot cake,2267
2,Bottarga is scarily colossal,Bottarga,2268
4,Thai hanglay curry is initially tense,Thai hanglay curry,2268
4,Ayam penyet is delightfully merciful,Ayam penyet,2268
3,Sour soup is unfortunately highfalutin,Sour soup,2268
1,Sundubu jjigae is however gentle,Sundubu jjigae,2268
1,Korma is unnecessarily instinctive,Korma,2268
1,Goi cuon is obnoxiously painful,Goi cuon,2269
1,Yakitori is freely federal,Yakitori,2269
4,Gado gado is eagerly curious,Gado gado,2269
8,Chicken galangal soup is regularly wicked,Chicken galangal soup,2269
2,Curry fish head is blissfully curved,Curry fish head,2269
1,French fries is knottily clean,French fries,2270
1,Tamales is viciously poor,Tamales,2270
2,Chilaquiles is upbeat disgusting,Chilaquiles,2270
1,Ramyeon is fatally savory,Ramyeon,2270
1,Bak kut teh is seemingly defeated,Bak kut teh,2270
6,Wanton mee is upward basic,Wanton mee,2271
1,Nasi goreng is joshingly lyrical,Nasi goreng,2271
4,Coconut milk curry is majestically odd,Coconut milk curry,2271
6,Fish kidney curry is recently free,Fish kidney curry,2271
1,Laksa is accidentally melodic,Laksa,2271
1,Noodles is terribly nauseating,Noodles,2271
4,Stir fried tofu with rice is reproachfully auspicious,Stir fried tofu with rice,2273
1,Spaghetti Aglio Olio is correctly rich,Spaghetti Aglio Olio,2273
2,Elote is fully basic,Elote,2273
3,Naan is ahead chief,Naan,2274
1,Spaghetti Aglio Olio is mainly basic,Spaghetti Aglio Olio,2274
2,Nasi goreng is playfully shiny,Nasi goreng,2274
3,Fried chicken is instantly cumbersome,Fried chicken,2274
3,Banh xeo is hopefully spiteful,Banh xeo,2274
1,Fish stew is calmly quirky,Fish stew,2274
2,Kimchi is jubilantly gabby,Kimchi,2274
4,Kimchi is readily tacit,Kimchi,2275
1,Szechwan chilli chicken is limply probable,Szechwan chilli chicken,2275
1,Tom yum goong is regularly mundane,Tom yum goong,2275
8,Gado gado is faithfully dreary,Gado gado,2276
2,Curry fish head is unimpressively automatic,Curry fish head,2276
2,Thai hanglay curry is offensively foregoing,Thai hanglay curry,2276
8,Ramen is weekly lucky,Ramen,2276
2,Spaghetti Bolognese is daily daffy,Spaghetti Bolognese,2277
1,Sundubu jjigae is solidly future,Sundubu jjigae,2277
2,Vegetable fried rice is intensely probable,Vegetable fried rice,2277
2,Sushi is virtually clean,Sushi,2277
1,Nem ran is carelessly upbeat,Nem ran,2277
1,Laksa is rarely sexual,Laksa,2277
4,Tom yum goong is effectively languid,Tom yum goong,2277
9,French fries is never delicious,French fries,2277
2,Kimchi stew is evenly general,Kimchi stew,2278
1,Murg makhani is reluctantly classy,Murg makhani,2278
1,Chicken with chestnuts is nicely spiffy,Chicken with chestnuts,2278
2,Stir fried tofu with rice is gently threatening,Stir fried tofu with rice,2278
2,Sashimi is properly free,Sashimi,2278
1,Hot and sour soup is lightly sparkling,Hot and sour soup,2279
6,Soto is fairly educated,Soto,2280
1,Polenta is lightly shaky,Polenta,2280
1,Pizza is defiantly lucky,Pizza,2280
7,Lasagna is constantly soggy,Lasagna,2280
8,Spaghetti Bolognese is quaintly tan,Spaghetti Bolognese,2281
3,Fish stew is separately dramatic,Fish stew,2281
10,Hokkien prawn mee is promptly decent,Hokkien prawn mee,2282
9,Sate is optimistically colossal,Sate,2282
2,Kimchi stew is boldly future,Kimchi stew,2282
3,Oyster omelette is below clean,Oyster omelette,2282
4,Spicy stir fried octopus is thus attractive,Spicy stir fried octopus,2283
10,Rawon is again somber,Rawon,2283
1,Banh khot is quaintly decent,Banh khot,2283
5,Ossobuco is inwardly lazy,Ossobuco,2283
1,Szechwan chilli chicken is inwardly slimy,Szechwan chilli chicken,2283
4,Spaghetti Bolognese is likely capricious,Spaghetti Bolognese,2283
1,Steak is ferociously logical,Steak,2284
5,Paratha is freely highfalutin,Paratha,2284
4,Lasagna is cleverly threatening,Lasagna,2284
10,Isaan soup is strictly glistening,Isaan soup,2284
4,Kaya toast is bitterly spotty,Kaya toast,2285
3,Vegetable fried rice is thoroughly round,Vegetable fried rice,2285
2,Soba is significantly future,Soba,2285
6,Spring rolls is primarily grieving,Spring rolls,2285
7,Rau muong is hopelessly deranged,Rau muong,2285
5,Lasagna is stealthily stiff,Lasagna,2285
1,Beef soup is freely cloudy,Beef soup,2285
2,Tom yum goong is obediently painful,Tom yum goong,2285
1,Kimchi stew is recently jumpy,Kimchi stew,2286
2,Nem ran is enormously nonchalant,Nem ran,2286
7,Soto is tenderly guiltless,Soto,2286
3,Gogigui is afterwards quirky,Gogigui,2287
6,Bak chor mee is usually mushy,Bak chor mee,2287
1,Ayam goreng is yesterday null,Ayam goreng,2287
1,Murg makhani is willfully tan,Murg makhani,2287
1,Papdi chaat is nervously grubby,Papdi chaat,2287
6,Ossobuco is awkwardly sick,Ossobuco,2287
1,Chicken with chestnuts is uselessly wicked,Chicken with chestnuts,2287
3,Fried chicken is keenly alcoholic,Fried chicken,2287
2,Risotto is rather spiteful,Risotto,2288
1,Chicken rice is generally selective,Chicken rice,2288
1,Murg makhani is fully lopsided,Murg makhani,2288
2,Curry fish head is literally resonant,Curry fish head,2288
3,Fish kidney curry is broadly somber,Fish kidney curry,2288
7,Samgyeopsal is mainly weak,Samgyeopsal,2289
4,Donburi is eventually elated,Donburi,2289
1,Chole is upward meaty,Chole,2289
1,Gado gado is tremendously curious,Gado gado,2289
1,Tofu is zealously dirty,Tofu,2290
2,Curry fish head is certainly fuzzy,Curry fish head,2290
5,Kimchi stew is sternly sparkling,Kimchi stew,2290
6,Cao lau is healthily instinctive,Cao lau,2290
6,Macaroni and Cheese is actually creepy,Macaroni and Cheese,2291
8,Fish stew is crossly jumpy,Fish stew,2291
4,Tamales is monthly small,Tamales,2292
1,Cha ca is relatively ruddy,Cha ca,2292
1,Vegetable fried rice is doubtfully like,Vegetable fried rice,2292
1,Coconut milk curry is abnormally green,Coconut milk curry,2292
1,Elote is zealously hateful,Elote,2292
2,Chiles en nogada is neatly deep,Chiles en nogada,2292
2,Vegetable fried rice is mainly deep,Vegetable fried rice,2293
8,Ramyeon is kiddingly terrific,Ramyeon,2293
5,Cha ca is silently hysterical,Cha ca,2294
1,Tacos al pastor is usually jumpy,Tacos al pastor,2294
1,Tempura is inwardly absorbing,Tempura,2294
4,Ga tan is initially shrill,Ga tan,2294
2,Fried carrot cake is perfectly basic,Fried carrot cake,2294
7,Pozole is unexpectedly best,Pozole,2295
4,Thai hanglay curry is always necessary,Thai hanglay curry,2295
5,Pho is owlishly synonymous,Pho,2295
2,Fish stew is recklessly delicate,Fish stew,2295
1,Nasi goreng is diligently cooperative,Nasi goreng,2296
5,Wanton mee is helpfully best,Wanton mee,2296
2,Polenta is hourly upbeat,Polenta,2296
7,Gogigui is cheerfully rich,Gogigui,2296
6,Chicken with chestnuts is jubilantly ragged,Chicken with chestnuts,2297
4,Spicy stir fried octopus is faithfully lucky,Spicy stir fried octopus,2297
1,Cantonese chicken soup is rarely round,Cantonese chicken soup,2297
2,Bhajji is obediently imperfect,Bhajji,2297
1,Ossobuco is initially disgusting,Ossobuco,2297
2,Fried carrot cake is shakily hysterical,Fried carrot cake,2298
8,Ayam penyet is daily dramatic,Ayam penyet,2298
3,Mole is initially wide,Mole,2298
2,Bhajji is viciously unbecoming,Bhajji,2298
9,Chocolate chip cookie is mostly necessary,Chocolate chip cookie,2298
4,Sichuan pork is broadly married,Sichuan pork,2298
6,Soba is loosely fuzzy,Soba,2299
1,Ribollita is together disgusted,Ribollita,2299
4,Chicken galangal soup is immediately auspicious,Chicken galangal soup,2299
1,Chicken tikka masala is devotedly fuzzy,Chicken tikka masala,2299
8,Hot and sour soup is upside-down elated,Hot and sour soup,2299
1,Guacamole is tensely grubby,Guacamole,2299
3,Coconut milk curry is sympathetically mixed,Coconut milk curry,2300
2,Kimchi is fatally smiling,Kimchi,2300
4,Pork bulgogi is happily disgusted,Pork bulgogi,2300
6,Macaroni and Cheese is occasionally unarmed,Macaroni and Cheese,2301
3,Ayam goreng is warmly threatening,Ayam goreng,2301
8,Chilaquiles is loosely faulty,Chilaquiles,2301
3,Bak chor mee is especially womanly,Bak chor mee,2301
6,Noodles is sheepishly unruly,Noodles,2301
3,Chicken with chestnuts is fast absorbed,Chicken with chestnuts,2301
1,Kaya toast is shakily jaded,Kaya toast,2301
4,Pizza is victoriously spurious,Pizza,2302
2,Soto is miserably dependent,Soto,2302
1,Dim sum is frightfully null,Dim sum,2302
8,Sichuan pork is gracefully painful,Sichuan pork,2303
5,Bottarga is hardly rustic,Bottarga,2303
1,Chicken with chestnuts is adventurously grubby,Chicken with chestnuts,2303
6,Ramyeon is busily elastic,Ramyeon,2304
2,Bibimbap is vivaciously womanly,Bibimbap,2304
6,Donburi is possibly purple,Donburi,2304
6,Rawon is truthfully drunk,Rawon,2304
1,Bakso is upliftingly gusty,Bakso,2304
2,Steak is bravely shaky,Steak,2304
10,Hot and sour soup is cheerfully competitive,Hot and sour soup,2304
1,Kimchi is overconfidently blue-eyed,Kimchi,2305
10,Chocolate chip cookie is innocently innate,Chocolate chip cookie,2305
2,Beef rendang is mysteriously threatening,Beef rendang,2305
2,Udon is coyly unique,Udon,2305
6,Bak chor mee is fast noxious,Bak chor mee,2305
1,Banh khot is actually fresh,Banh khot,2305
7,Noodles is upward grieving,Noodles,2305
1,Bottarga is fervently slim,Bottarga,2306
6,Steak is queasily drunk,Steak,2306
1,Wanton mee is queerly wiry,Wanton mee,2306
1,Spicy stir fried octopus is thoroughly scared,Spicy stir fried octopus,2306
5,Risotto is elegantly lame,Risotto,2306
2,Ga tan is completely soggy,Ga tan,2306
2,Hash browns is recently nervous,Hash browns,2306
3,Tempura is tightly standing,Tempura,2306
1,Green curry chicken is thoroughly lopsided,Green curry chicken,2307
1,Rau muong is playfully flowery,Rau muong,2307
2,Cheeseburger is necessarily homely,Cheeseburger,2307
11,Kaya toast is previously stiff,Kaya toast,2308
1,Chicken wings is specifically immediate,Chicken wings,2308
2,Yakitori is hourly natural,Yakitori,2308
6,Sundubu jjigae is enthusiastically ruddy,Sundubu jjigae,2308
1,Soba is already logical,Soba,2308
3,Tacos al pastor is unimpressively pushy,Tacos al pastor,2308
8,Tamales is intensely foregoing,Tamales,2308
1,Bak kut teh is voluntarily rigid,Bak kut teh,2308
1,Sundubu jjigae is partially dapper,Sundubu jjigae,2309
2,Macaroni and Cheese is thus instinctive,Macaroni and Cheese,2309
2,Pozole is reluctantly federal,Pozole,2309
6,Banh xeo is yieldingly cloudy,Banh xeo,2309
1,Bhajji is rigidly upbeat,Bhajji,2309
2,Ayam penyet is immediately ugly,Ayam penyet,2309
8,Kimchi is occasionally confident,Kimchi,2309
2,Elote is basically dapper,Elote,2309
1,Ossobuco is thoughtfully dizzy,Ossobuco,2309
2,Cantonese chicken soup is woefully swanky,Cantonese chicken soup,2309
4,Fried carrot cake is deftly cultured,Fried carrot cake,2310
2,Banh khot is wrongly damaging,Banh khot,2310
9,Ossobuco is blindly mushy,Ossobuco,2310
1,Szechwan chilli chicken is inquisitively childlike,Szechwan chilli chicken,2310
1,Spaghetti Bolognese is virtually colossal,Spaghetti Bolognese,2310
3,Kaya toast is fervently painful,Kaya toast,2311
4,Coconut milk curry is meaningfully overrated,Coconut milk curry,2311
1,Isaan soup is yieldingly slimy,Isaan soup,2311
4,Pizza is noisily tart,Pizza,2311
3,Nasi goreng is loyally normal,Nasi goreng,2311
2,Soba is upside-down confident,Soba,2312
1,Ga tan is jealously adventurous,Ga tan,2312
1,Ribollita is lively didactic,Ribollita,2312
1,Gado gado is twice jumpy,Gado gado,2313
1,Banh xeo is lightly dramatic,Banh xeo,2313
1,Ossobuco is devotedly fuzzy,Ossobuco,2313
2,Coconut milk curry is loyally didactic,Coconut milk curry,2313
4,Fried chicken is merrily adventurous,Fried chicken,2313
1,Tamales is greatly mushy,Tamales,2313
3,Bak kut teh is soon gabby,Bak kut teh,2313
1,Tostadas is recently several,Tostadas,2314
5,Ga tan is justly basic,Ga tan,2314
5,Donburi is noisily staking,Donburi,2314
1,Samgyeopsal is busily adventurous,Samgyeopsal,2314
5,Mole is zealously dirty,Mole,2314
6,Bun bo hue is abnormally general,Bun bo hue,2314
4,Noodles is commonly clean,Noodles,2316
2,Steak is unexpectedly tan,Steak,2316
3,Macaroni and Cheese is jaggedly tart,Macaroni and Cheese,2316
7,Chilaquiles is doubtfully changeable,Chilaquiles,2316
9,Bun bo hue is rapidly savory,Bun bo hue,2316
5,Sundubu jjigae is diligently dapper,Sundubu jjigae,2317
5,Rawon is likely glistening,Rawon,2317
1,Banh khot is gracefully acceptable,Banh khot,2317
1,Steak is rightfully regular,Steak,2318
5,Fried chicken is separately capricious,Fried chicken,2318
9,Cantonese chicken soup is oddly spurious,Cantonese chicken soup,2318
6,Soto is oddly yielding,Soto,2318
1,Bottarga is beautifully aquatic,Bottarga,2319
2,Spicy stir fried octopus is effectively serious,Spicy stir fried octopus,2319
1,Chicken with chestnuts is finally rampant,Chicken with chestnuts,2319
1,Bakso is verbally grateful,Bakso,2320
6,Lasagna is madly cloudy,Lasagna,2320
1,Pizza is famously decent,Pizza,2320
5,Oyster omelette is twice wandering,Oyster omelette,2321
10,Steak is honestly general,Steak,2321
6,Cao lau is viciously adventurous,Cao lau,2321
2,Boiled vegetable soup is cruelly vacuous,Boiled vegetable soup,2321
8,Ayam penyet is merrily spotty,Ayam penyet,2322
7,Sundubu jjigae is bleakly attractive,Sundubu jjigae,2322
4,Cantonese chicken soup is kindheartedly homely,Cantonese chicken soup,2323
3,Banh khot is else reflective,Banh khot,2323
7,Spaghetti Aglio Olio is upright actually,Spaghetti Aglio Olio,2323
1,Tofu is totally vast,Tofu,2323
2,Sundubu jjigae is daintily foregoing,Sundubu jjigae,2323
5,Pizza is however bite-sized,Pizza,2324
1,Soba is tomorrow mountainous,Soba,2324
1,Tofu is utterly pushy,Tofu,2324
1,Naan is only berserk,Naan,2324
6,Chicken rice is correctly adventurous,Chicken rice,2324
2,Bak kut teh is urgently troubled,Bak kut teh,2324
1,Guacamole is elsewhere quiet,Guacamole,2324
2,Nasi goreng is coaxingly bitter,Nasi goreng,2324
3,Spaghetti Bolognese is surprisingly graceful,Spaghetti Bolognese,2324
3,Wanton mee is gracefully somber,Wanton mee,2325
2,Chicken rice is zealously ashamed,Chicken rice,2325
3,Rujak cingur is gladly ruddy,Rujak cingur,2325
1,Coconut milk curry is jealously spiteful,Coconut milk curry,2326
2,Rau muong is briskly obese,Rau muong,2326
1,Fish kidney curry is foolishly dull,Fish kidney curry,2326
1,Beef soup is zestfully endurable,Beef soup,2326
2,Szechwan chilli chicken is relatively abashed,Szechwan chilli chicken,2326
1,Macaroni and Cheese is swiftly mountainous,Macaroni and Cheese,2326
3,Cantonese chicken soup is sleepily vast,Cantonese chicken soup,2326
6,Spaghetti Carbonara is not weak,Spaghetti Carbonara,2326
4,Palak paneer is afterwards painful,Palak paneer,2326
4,Ayam goreng is unimpressively waiting,Ayam goreng,2327
1,Curry fish head is questionably deep,Curry fish head,2327
3,Vegetable fried rice is bleakly full,Vegetable fried rice,2327
5,Cha ca is far purple,Cha ca,2327
2,Murg makhani is truthfully adventurous,Murg makhani,2327
2,Thai hanglay curry is uselessly classy,Thai hanglay curry,2328
3,Chicken tikka masala is yawningly weak,Chicken tikka masala,2328
3,Murg makhani is reproachfully gigantic,Murg makhani,2328
5,Chicken galangal soup is soon smiling,Chicken galangal soup,2328
2,Tacos al pastor is sternly dull,Tacos al pastor,2328
8,Mole is defiantly tight,Mole,2329
7,Hash browns is annually bouncy,Hash browns,2329
7,Ramyeon is fast alcoholic,Ramyeon,2329
1,Rawon is sedately scary,Rawon,2330
2,Laksa is vivaciously screeching,Laksa,2330
3,Cheeseburger is beautifully foreign,Cheeseburger,2330
1,Tofu is boastfully curious,Tofu,2330
2,Chicken tikka masala is obnoxiously therapeutic,Chicken tikka masala,2330
4,Cheeseburger is fervently curious,Cheeseburger,2331
1,Tandoori chicken is then disillusioned,Tandoori chicken,2331
2,Dim sum is daily bright,Dim sum,2332
1,French fries is miserably skillful,French fries,2332
1,Elote is very several,Elote,2332
1,Cao lau is usually tart,Cao lau,2333
5,Ramen is dreamily decent,Ramen,2333
4,Boiled vegetable soup is irritably plausible,Boiled vegetable soup,2333
2,Pho is probably well-to-do,Pho,2333
5,Banh xeo is frankly shiny,Banh xeo,2333
1,Bun bo hue is keenly basic,Bun bo hue,2333
1,Chicken with chestnuts is utterly wide-eyed,Chicken with chestnuts,2334
8,Natto is viciously faulty,Natto,2334
4,Fried carrot cake is hungrily wandering,Fried carrot cake,2334
3,Chiles en nogada is normally wanting,Chiles en nogada,2334
3,Hash browns is automatically pushy,Hash browns,2334
1,Cao lau is instantly friendly,Cao lau,2334
1,Tacos al pastor is completely tart,Tacos al pastor,2335
1,Pho is longingly several,Pho,2335
1,Noodles is always abashed,Noodles,2335
1,Szechwan chilli chicken is suddenly gigantic,Szechwan chilli chicken,2335
1,Vegetable fried rice is energetically pink,Vegetable fried rice,2335
10,Wanton mee is nicely calm,Wanton mee,2336
3,Fish kidney curry is zealously eastern,Fish kidney curry,2336
2,Laksa is enormously flat,Laksa,2336
5,Banh xeo is slowly vivacious,Banh xeo,2336
1,Pozole is broadly threatening,Pozole,2336
1,Noodles is rapidly probable,Noodles,2336
4,Sundubu jjigae is lovingly rich,Sundubu jjigae,2337
1,Soba is anxiously probable,Soba,2337
2,Spaghetti Aglio Olio is openly shaky,Spaghetti Aglio Olio,2338
7,Ga tan is quizzically somber,Ga tan,2338
1,Rujak cingur is loosely yielding,Rujak cingur,2338
6,Palak paneer is enthusiastically actually,Palak paneer,2338
1,Bhajji is mainly flashy,Bhajji,2338
7,Steak is very rampant,Steak,2339
1,Paratha is joyfully spiffy,Paratha,2339
2,Lasagna is kissingly slimy,Lasagna,2339
4,Ramyeon is instantly friendly,Ramyeon,2339
3,Boiled vegetable soup is hardly necessary,Boiled vegetable soup,2339
8,Isaan soup is exactly well-to-do,Isaan soup,2339
1,Korma is usually bumpy,Korma,2340
2,Donburi is truthfully sturdy,Donburi,2340
9,Spicy stir fried octopus is lazily cool,Spicy stir fried octopus,2340
1,Nasi goreng is wearily fertile,Nasi goreng,2340
8,Fish stew is daily wasteful,Fish stew,2340
3,Gogigui is far tired,Gogigui,2341
1,Nasi goreng is literally shiny,Nasi goreng,2341
4,Ayam goreng is wildly amused,Ayam goreng,2341
1,Murg makhani is vastly deep,Murg makhani,2341
3,Isaan soup is sweetly noiseless,Isaan soup,2341
3,Papdi chaat is bashfully meaty,Papdi chaat,2341
1,Cao lau is specifically assorted,Cao lau,2341
6,Pork bulgogi is unabashedly rigid,Pork bulgogi,2341
1,Ossobuco is rapidly amuck,Ossobuco,2341
3,Chilaquiles is unexpectedly tender,Chilaquiles,2341
1,Chicken with chestnuts is wholly puzzled,Chicken with chestnuts,2341
10,Pho is poorly psychedelic,Pho,2341
2,Fried chicken is softly broad,Fried chicken,2341
5,Rujak cingur is quizzically somber,Rujak cingur,2342
10,Bak kut teh is triumphantly dependent,Bak kut teh,2342
5,Fried chicken is arrogantly threatening,Fried chicken,2343
4,Isaan soup is officially unsightly,Isaan soup,2343
5,Ramen is knowledgeably psychedelic,Ramen,2343
1,Banh xeo is urgently shaky,Banh xeo,2344
1,Sour soup is kookily wretched,Sour soup,2344
4,Spicy stir fried octopus is naturally tangible,Spicy stir fried octopus,2345
4,Rau muong is oddly squealing,Rau muong,2346
9,Goi cuon is fortunately purple,Goi cuon,2346
4,Ribollita is coaxingly sturdy,Ribollita,2346
1,Rawon is surprisingly regular,Rawon,2346
9,Green curry chicken is unfortunately flaky,Green curry chicken,2346
2,Isaan soup is rarely hysterical,Isaan soup,2346
3,Ramyeon is well broad,Ramyeon,2347
3,Hot and sour soup is similarly colorful,Hot and sour soup,2347
4,Kimchi is faithfully spiffy,Kimchi,2347
