quantity,review,fname,orderid
7,Enchiladas is busily annoying,Enchiladas,1463
1,Spring rolls is vainly adventurous,Spring rolls,1463
1,Isaan soup is frequently wide,Isaan soup,1464
2,Enchiladas is everywhere cool,Enchiladas,1464
8,Beef soup is primarily helpless,Beef soup,1464
4,Murg makhani is specifically substantial,Murg makhani,1465
1,Donburi is famously mixed,Donburi,1465
2,Hash browns is completely decent,Hash browns,1465
7,Sashimi is urgently berserk,Sashimi,1465
8,Soto is neatly wide,Soto,1465
1,Doughnut is upright somber,Doughnut,1467
1,Pozole is fiercely shocking,Pozole,1467
1,Pizza is faithfully foreign,Pizza,1467
3,Sate is fast evasive,Sate,1468
3,Goi cuon is afterwards flowery,Goi cuon,1468
2,Szechwan chilli chicken is defiantly hateful,Szechwan chilli chicken,1468
1,Spaghetti Carbonara is victoriously zesty,Spaghetti Carbonara,1468
3,Tandoori chicken is well certain,Tandoori chicken,1468
3,Sashimi is somewhat threatening,Sashimi,1468
6,Samgyeopsal is terrifically clean,Samgyeopsal,1469
3,Enchiladas is unaccountably informal,Enchiladas,1469
1,Polenta is upside-down traditional,Polenta,1470
8,Tempura is effectively wide,Tempura,1470
2,Pozole is frankly temporary,Pozole,1470
1,Rujak cingur is never sturdy,Rujak cingur,1470
6,Banh khot is unaccountably colossal,Banh khot,1470
10,Ribollita is frantically sturdy,Ribollita,1470
8,Sichuan pork is roughly obese,Sichuan pork,1470
4,Fish stew is helpfully thinkable,Fish stew,1470
1,Fish kidney curry is positively berserk,Fish kidney curry,1470
4,Tandoori chicken is normally unfair,Tandoori chicken,1470
4,Szechwan chilli chicken is obediently quiet,Szechwan chilli chicken,1471
7,Boiled vegetable soup is willfully acoustic,Boiled vegetable soup,1471
1,Apple pie is originally volatile,Apple pie,1471
1,Bhajji is punctually dangerous,Bhajji,1471
1,Bottarga is victoriously regular,Bottarga,1471
4,Kimchi stew is powerfully quick,Kimchi stew,1472
3,Hot and sour soup is hopelessly somber,Hot and sour soup,1472
1,Apple pie is yieldingly decent,Apple pie,1473
1,Soto is vaguely general,Soto,1473
1,Rujak cingur is seldom rampant,Rujak cingur,1474
2,Rawon is quaintly null,Rawon,1474
2,Tofu is nicely one,Tofu,1475
5,Noodles is gleefully terrific,Noodles,1475
5,Spicy stir fried octopus is not cheap,Spicy stir fried octopus,1475
4,Fried chicken is painfully colorful,Fried chicken,1475
4,Tostadas is usually synonymous,Tostadas,1475
4,Nasi goreng is rapidly basic,Nasi goreng,1476
3,Korma is loosely madly,Korma,1476
3,Soba is easily resonant,Soba,1477
5,Natto is deceivingly adventurous,Natto,1477
9,Sashimi is readily educated,Sashimi,1478
4,Banh xeo is almost regular,Banh xeo,1478
7,Rujak cingur is deliberately foolish,Rujak cingur,1479
5,Wanton mee is intensely possessive,Wanton mee,1479
2,Tandoori chicken is overconfidently small,Tandoori chicken,1479
3,Chicken wings is usefully zealous,Chicken wings,1480
7,Chole is cleverly like,Chole,1480
3,Chiles en nogada is crossly wiry,Chiles en nogada,1480
8,Thai hanglay curry is frenetically plausible,Thai hanglay curry,1481
1,Curry fish head is completely acceptable,Curry fish head,1481
6,Pozole is zestily dependent,Pozole,1481
5,Ayam goreng is obediently changeable,Ayam goreng,1481
2,Dim sum is lovingly volatile,Dim sum,1482
2,Mole is wholly grubby,Mole,1483
5,Sichuan pork is frequently kind,Sichuan pork,1483
8,Oyster omelette is generally gigantic,Oyster omelette,1483
6,Curry fish head is perfectly basic,Curry fish head,1484
3,Spaghetti Aglio Olio is honestly glamorous,Spaghetti Aglio Olio,1484
8,Paratha is fairly amuck,Paratha,1484
4,Tamales is helpfully various,Tamales,1484
1,Ga tan is often daffy,Ga tan,1484
2,Banh khot is cautiously acidic,Banh khot,1484
1,Nem ran is simply adventurous,Nem ran,1484
4,Chicken galangal soup is wisely additional,Chicken galangal soup,1485
11,Ayam penyet is slightly logical,Ayam penyet,1485
3,Tofu is generously decisive,Tofu,1486
1,Vegetable fried rice is sadly dreary,Vegetable fried rice,1486
2,Kimchi stew is exactly nauseating,Kimchi stew,1486
4,Risotto is fatally grubby,Risotto,1487
8,Naan is noisily tight,Naan,1487
1,Szechwan chilli chicken is courageously stormy,Szechwan chilli chicken,1487
4,Dim sum is already colossal,Dim sum,1487
2,Steak is woefully adventurous,Steak,1487
2,Hash browns is overconfidently classy,Hash browns,1487
1,Murg makhani is too spotless,Murg makhani,1488
4,Spaghetti Aglio Olio is previously vacuous,Spaghetti Aglio Olio,1488
2,Tacos al pastor is ever competitive,Tacos al pastor,1488
1,Wanton mee is knowledgeably absorbed,Wanton mee,1488
2,Fish stew is freely vacuous,Fish stew,1488
1,Bun bo hue is oddly aquatic,Bun bo hue,1488
3,Palak paneer is moreover confident,Palak paneer,1489
1,Kaya toast is quarrelsomely lame,Kaya toast,1489
8,Tostadas is rapidly damaged,Tostadas,1489
1,Enchiladas is also embarrassed,Enchiladas,1489
9,Ga tan is hungrily serious,Ga tan,1490
4,Chicken rice is properly substantial,Chicken rice,1490
10,Palak paneer is specifically flippant,Palak paneer,1490
9,Ayam penyet is mortally sick,Ayam penyet,1490
2,Stir fried tofu with rice is steadily lame,Stir fried tofu with rice,1491
1,Sashimi is seriously zealous,Sashimi,1491
6,Palak paneer is inwardly nonchalant,Palak paneer,1491
6,Cao lau is enormously stormy,Cao lau,1491
1,Bibimbap is already additional,Bibimbap,1491
3,Tandoori chicken is defiantly faulty,Tandoori chicken,1491
1,Lasagna is loyally curious,Lasagna,1491
1,Ramyeon is coaxingly annoying,Ramyeon,1491
5,Thai hanglay curry is voluntarily grubby,Thai hanglay curry,1492
3,Sichuan pork is moreover fuzzy,Sichuan pork,1492
3,Sate is sheepishly flowery,Sate,1493
6,Cheeseburger is accidentally dapper,Cheeseburger,1493
1,Yakitori is weakly damaged,Yakitori,1493
7,Thai hanglay curry is ever colossal,Thai hanglay curry,1494
10,Risotto is coaxingly pushy,Risotto,1494
3,Noodles is scarily spiffy,Noodles,1494
1,Laksa is very flat,Laksa,1494
6,Pork bulgogi is lightly drunk,Pork bulgogi,1494
6,Donburi is then tight,Donburi,1494
1,Spaghetti Aglio Olio is needily lush,Spaghetti Aglio Olio,1494
4,Samgyeopsal is joshingly tranquil,Samgyeopsal,1494
2,Tandoori chicken is sharply future,Tandoori chicken,1494
4,Wanton mee is bashfully imminent,Wanton mee,1495
4,Coconut milk curry is kindheartedly dizzy,Coconut milk curry,1495
3,Fish kidney curry is certainly lazy,Fish kidney curry,1495
9,Naan is extremely fast,Naan,1495
1,Pozole is unnaturally hesitant,Pozole,1495
2,Noodles is forth ashamed,Noodles,1495
4,Soba is loudly spurious,Soba,1496
4,Rau muong is nervously spiky,Rau muong,1496
1,Hash browns is scarcely yielding,Hash browns,1496
1,Ga tan is normally decent,Ga tan,1496
1,Natto is effectively grateful,Natto,1496
9,Ribollita is vacantly adjoining,Ribollita,1496
8,Kaya toast is mockingly noiseless,Kaya toast,1497
7,Spicy stir fried octopus is more synonymous,Spicy stir fried octopus,1497
2,Sour soup is truthfully tangible,Sour soup,1497
1,Rau muong is crazily momentous,Rau muong,1497
6,Boiled vegetable soup is warmly colorful,Boiled vegetable soup,1497
4,Stir fried tofu with rice is mockingly melodic,Stir fried tofu with rice,1497
10,Sashimi is excitedly chief,Sashimi,1497
2,Tofu is never unfair,Tofu,1498
5,Tandoori chicken is eagerly best,Tandoori chicken,1498
5,Chilaquiles is merely spiteful,Chilaquiles,1498
6,Laksa is upwardly gigantic,Laksa,1498
8,Fish stew is safely confident,Fish stew,1498
2,Bhajji is hungrily disgusting,Bhajji,1499
1,Pizza is freely decent,Pizza,1499
6,Cao lau is bleakly gusty,Cao lau,1499
1,Dim sum is exactly dull,Dim sum,1499
1,Curry fish head is questionably several,Curry fish head,1499
2,Ramen is questioningly spotless,Ramen,1499
4,Chicken tikka masala is queerly unfair,Chicken tikka masala,1500
6,Naan is valiantly flashy,Naan,1500
2,Chicken wings is potentially shaky,Chicken wings,1500
1,Noodles is awkwardly descriptive,Noodles,1500
1,Ayam penyet is frightfully additional,Ayam penyet,1501
10,Cantonese chicken soup is frankly rich,Cantonese chicken soup,1501
1,Murg makhani is already wandering,Murg makhani,1501
1,Kaya toast is virtually necessary,Kaya toast,1501
1,Chicken wings is certainly regular,Chicken wings,1502
4,Bhajji is likely loving,Bhajji,1502
2,Kimchi stew is likely mean,Kimchi stew,1502
4,Mole is oddly momentous,Mole,1503
2,Curry fish head is reproachfully tan,Curry fish head,1503
1,Chicken galangal soup is lazily changeable,Chicken galangal soup,1503
4,Ramyeon is freely similar,Ramyeon,1503
1,Enchiladas is dreamily amuck,Enchiladas,1503
4,Noodles is constantly flat,Noodles,1504
6,Lasagna is coolly plausible,Lasagna,1504
3,Dim sum is steadily madly,Dim sum,1504
2,Bhajji is partially dynamic,Bhajji,1504
3,Tostadas is nicely sturdy,Tostadas,1504
2,Chole is loftily terrific,Chole,1504
1,Soto is directly wide,Soto,1504
4,Chicken galangal soup is extremely sparkling,Chicken galangal soup,1505
3,Spring rolls is quietly gigantic,Spring rolls,1505
2,Kimchi is angrily momentous,Kimchi,1505
1,Fish stew is wetly sexual,Fish stew,1505
2,Elote is thankfully shocking,Elote,1505
2,Cha ca is queerly helpless,Cha ca,1505
4,Bak kut teh is even adventurous,Bak kut teh,1505
2,Boiled vegetable soup is generously reflective,Boiled vegetable soup,1506
2,Cantonese chicken soup is tensely cumbersome,Cantonese chicken soup,1506
1,Beef rendang is slowly necessary,Beef rendang,1507
6,Goi cuon is briskly dapper,Goi cuon,1507
11,Kaya toast is shakily automatic,Kaya toast,1507
2,Spring rolls is verbally willing,Spring rolls,1507
2,Cha ca is offensively spotted,Cha ca,1508
1,Coconut milk curry is moreover adjoining,Coconut milk curry,1508
1,Udon is joyously tranquil,Udon,1508
3,Wanton mee is carelessly wide,Wanton mee,1508
10,Szechwan chilli chicken is briefly competitive,Szechwan chilli chicken,1508
1,Noodles is rudely amused,Noodles,1509
4,Enchiladas is swiftly spiteful,Enchiladas,1509
3,Ayam goreng is youthfully sturdy,Ayam goreng,1509
1,Chicken with chestnuts is optimistically asleep,Chicken with chestnuts,1510
9,Palak paneer is coyly foregoing,Palak paneer,1510
7,Szechwan chilli chicken is mechanically quiet,Szechwan chilli chicken,1510
1,Fried carrot cake is softly serious,Fried carrot cake,1510
4,Stir fried tofu with rice is ultimately evasive,Stir fried tofu with rice,1510
3,Hot and sour soup is boastfully future,Hot and sour soup,1510
1,Yakitori is hardly odd,Yakitori,1510
1,Mole is upliftingly womanly,Mole,1511
3,Beef rendang is tomorrow vacuous,Beef rendang,1511
5,Sichuan pork is easily disgusted,Sichuan pork,1511
1,Sundubu jjigae is vainly innate,Sundubu jjigae,1512
2,Chicken galangal soup is rather synonymous,Chicken galangal soup,1512
1,Hash browns is tomorrow informal,Hash browns,1512
1,Rawon is fast bouncy,Rawon,1513
2,Sushi is poorly standing,Sushi,1513
1,Naan is surprisingly future,Naan,1513
4,Korma is noisily normal,Korma,1513
4,Tostadas is elsewhere madly,Tostadas,1513
9,Elote is perfectly naive,Elote,1513
7,Nasi goreng is currently true,Nasi goreng,1514
2,Risotto is not various,Risotto,1514
1,Spaghetti Bolognese is sometimes bizarre,Spaghetti Bolognese,1514
5,Sashimi is unfortunately noiseless,Sashimi,1514
7,Paratha is finally cool,Paratha,1515
9,Murg makhani is scarily shut,Murg makhani,1515
6,Sour soup is seldom berserk,Sour soup,1515
2,Guacamole is hourly attractive,Guacamole,1515
1,Wanton mee is basically thirsty,Wanton mee,1515
9,Chilaquiles is tensely fertile,Chilaquiles,1515
2,Bottarga is deftly painful,Bottarga,1515
6,Nasi goreng is always pink,Nasi goreng,1515
8,Spicy stir fried octopus is yearly quiet,Spicy stir fried octopus,1515
3,Sushi is hopefully lopsided,Sushi,1516
2,Risotto is angrily asleep,Risotto,1516
2,Tostadas is ahead jumpy,Tostadas,1516
1,Chicken galangal soup is upwardly melodic,Chicken galangal soup,1516
8,Stir fried tofu with rice is weakly standing,Stir fried tofu with rice,1516
1,Udon is frankly staking,Udon,1516
1,Hot and sour soup is really weak,Hot and sour soup,1517
3,Vegetable fried rice is then synonymous,Vegetable fried rice,1517
1,Pozole is roughly short,Pozole,1517
10,Bottarga is lazily womanly,Bottarga,1517
1,Beef rendang is literally purple,Beef rendang,1517
7,Macaroni and Cheese is nearly competitive,Macaroni and Cheese,1517
4,Sushi is physically cloudy,Sushi,1517
4,Spaghetti Bolognese is literally yielding,Spaghetti Bolognese,1518
2,Wanton mee is briskly roasted,Wanton mee,1518
1,Sour soup is simply merciful,Sour soup,1519
2,Chicken tikka masala is quickly substantial,Chicken tikka masala,1519
2,Spaghetti Bolognese is deceivingly alluring,Spaghetti Bolognese,1519
3,Banh khot is dearly obsequious,Banh khot,1519
2,Chocolate chip cookie is loftily quiet,Chocolate chip cookie,1519
2,Natto is previously flat,Natto,1519
1,Paratha is bravely clean,Paratha,1519
1,Banh xeo is weekly nervous,Banh xeo,1520
2,Hokkien prawn mee is somewhat tight,Hokkien prawn mee,1520
4,Spaghetti Aglio Olio is already standing,Spaghetti Aglio Olio,1520
1,Wanton mee is smoothly wrathful,Wanton mee,1520
10,Ribollita is vainly null,Ribollita,1520
1,Bun bo hue is loudly attractive,Bun bo hue,1520
2,Tacos al pastor is swiftly blue-eyed,Tacos al pastor,1521
1,Bibimbap is briskly sparkling,Bibimbap,1521
1,Pho is tomorrow lazy,Pho,1521
2,Udon is moreover acoustic,Udon,1521
1,Enchiladas is therefore troubled,Enchiladas,1521
1,Vegetable fried rice is totally noiseless,Vegetable fried rice,1521
4,Chicken wings is currently lyrical,Chicken wings,1522
1,Ga tan is tremendously naive,Ga tan,1522
2,Sashimi is brightly tender,Sashimi,1522
1,Macaroni and Cheese is questioningly several,Macaroni and Cheese,1522
1,Ayam goreng is coaxingly various,Ayam goreng,1523
7,Cantonese chicken soup is unimpressively synonymous,Cantonese chicken soup,1523
2,Hash browns is fondly changeable,Hash browns,1523
7,Spaghetti Aglio Olio is rarely tall,Spaghetti Aglio Olio,1523
2,Bhajji is bitterly quiet,Bhajji,1523
2,Cheeseburger is queasily inconclusive,Cheeseburger,1523
1,Vegetable fried rice is knottily flat,Vegetable fried rice,1523
4,Banh khot is together noxious,Banh khot,1523
2,Enchiladas is zestfully alcoholic,Enchiladas,1524
3,Sundubu jjigae is hopelessly drunk,Sundubu jjigae,1524
8,Pizza is slightly new,Pizza,1524
1,Korma is personally somber,Korma,1524
3,Bak chor mee is gratefully hospitable,Bak chor mee,1524
5,Lasagna is kindly educated,Lasagna,1525
3,Chocolate chip cookie is intensely foreign,Chocolate chip cookie,1525
1,Bibimbap is wonderfully descriptive,Bibimbap,1525
1,Soto is knowledgeably wretched,Soto,1525
8,Natto is lazily kind,Natto,1526
4,Dim sum is continually wonderful,Dim sum,1526
2,Chiles en nogada is searchingly defeated,Chiles en nogada,1526
3,Risotto is knottily acidic,Risotto,1526
2,Hash browns is helpfully wasteful,Hash browns,1526
2,Cao lau is sympathetically fast,Cao lau,1526
5,Tacos al pastor is diligently fuzzy,Tacos al pastor,1526
3,Chicken wings is needily adventurous,Chicken wings,1527
4,Pizza is altogether lame,Pizza,1527
2,Paratha is forth vast,Paratha,1527
5,French fries is speedily consistent,French fries,1527
2,Ga tan is tenderly big,Ga tan,1528
5,Fried carrot cake is more languid,Fried carrot cake,1528
3,Ramyeon is unbearably mushy,Ramyeon,1529
4,Hot and sour soup is always flowery,Hot and sour soup,1529
1,Kimchi is dramatically lucky,Kimchi,1529
1,Chole is kiddingly waiting,Chole,1530
1,Tofu is judgementally nauseating,Tofu,1530
3,Ayam penyet is speedily delicious,Ayam penyet,1531
2,Nem ran is however bouncy,Nem ran,1531
2,Spring rolls is usefully acidic,Spring rolls,1531
2,Beef soup is yearly acceptable,Beef soup,1531
1,Pizza is longingly pushy,Pizza,1532
5,Chicken tikka masala is rarely acidic,Chicken tikka masala,1532
7,Spaghetti Aglio Olio is courageously realistic,Spaghetti Aglio Olio,1532
5,Soto is actually hysterical,Soto,1532
2,Bakso is neatly vast,Bakso,1532
7,Dim sum is mainly defeated,Dim sum,1532
2,Tempura is coolly fertile,Tempura,1533
10,Elote is solidly bright,Elote,1533
1,Chicken wings is scarcely loving,Chicken wings,1533
2,Palak paneer is eagerly rude,Palak paneer,1533
9,Hokkien prawn mee is stealthily informal,Hokkien prawn mee,1534
4,Ribollita is deeply creepy,Ribollita,1534
3,Kimchi stew is likely mean,Kimchi stew,1534
3,Oyster omelette is acidly fast,Oyster omelette,1534
3,Sour soup is significantly new,Sour soup,1535
6,Kimchi stew is happily tan,Kimchi stew,1535
7,Tacos al pastor is needily thirsty,Tacos al pastor,1535
1,Banh khot is valiantly serious,Banh khot,1535
6,Natto is loyally dapper,Natto,1535
2,Sashimi is correctly lame,Sashimi,1535
1,Paratha is deeply willing,Paratha,1535
1,Ga tan is sleepily upbeat,Ga tan,1536
1,Chicken tikka masala is rigidly dependent,Chicken tikka masala,1536
2,Goi cuon is evenly lucky,Goi cuon,1537
2,Bak kut teh is sweetly thirsty,Bak kut teh,1537
2,Pizza is dimly elated,Pizza,1537
1,Paratha is punctually logical,Paratha,1537
3,Pozole is joyously fresh,Pozole,1537
1,Noodles is afterwards terrific,Noodles,1537
4,Banh xeo is especially reflective,Banh xeo,1538
3,Fish stew is happily aquatic,Fish stew,1538
1,Banh khot is even adventurous,Banh khot,1538
2,Chicken galangal soup is dimly shiny,Chicken galangal soup,1538
2,Sushi is extremely lazy,Sushi,1538
1,Thai hanglay curry is viciously ragged,Thai hanglay curry,1539
2,Goi cuon is ahead merciful,Goi cuon,1539
1,Bibimbap is currently flaky,Bibimbap,1539
6,Stir fried tofu with rice is possibly flippant,Stir fried tofu with rice,1539
1,Tofu is loudly gabby,Tofu,1539
1,Soto is currently shocking,Soto,1540
1,Szechwan chilli chicken is therefore pink,Szechwan chilli chicken,1540
10,Tom yum goong is woefully poor,Tom yum goong,1540
5,Bibimbap is warmly womanly,Bibimbap,1541
4,Sushi is unnecessarily regular,Sushi,1541
8,Yakitori is loudly various,Yakitori,1542
1,Ossobuco is rigidly jobless,Ossobuco,1542
1,Mole is else courageous,Mole,1542
1,Steak is dimly embarrassed,Steak,1542
2,Bhajji is equally classy,Bhajji,1542
3,Palak paneer is unfortunately assorted,Palak paneer,1543
4,Isaan soup is readily shaky,Isaan soup,1543
1,Murg makhani is triumphantly overrated,Murg makhani,1543
4,Tostadas is bleakly cooperative,Tostadas,1543
2,Hokkien prawn mee is greatly berserk,Hokkien prawn mee,1543
1,Spaghetti Carbonara is bitterly weak,Spaghetti Carbonara,1543
3,Pizza is elegantly merciful,Pizza,1544
1,Pozole is loftily kaput,Pozole,1544
4,Gado gado is mechanically rustic,Gado gado,1544
5,Isaan soup is boldly highfalutin,Isaan soup,1544
2,Beef rendang is unnaturally drunk,Beef rendang,1545
4,Gado gado is generously mushy,Gado gado,1545
1,Soto is jovially round,Soto,1545
2,Risotto is quizzically squealing,Risotto,1545
3,Papdi chaat is roughly additional,Papdi chaat,1545
7,French fries is unfortunately shaky,French fries,1546
8,Samgyeopsal is gladly courageous,Samgyeopsal,1547
4,Stir fried tofu with rice is seemingly full,Stir fried tofu with rice,1547
5,Donburi is officially educated,Donburi,1547
2,Nem ran is frenetically helpless,Nem ran,1547
2,Curry fish head is blissfully piquant,Curry fish head,1547
1,Bhajji is quaintly vast,Bhajji,1547
1,Soba is curiously piquant,Soba,1547
1,Fried carrot cake is unimpressively general,Fried carrot cake,1548
5,Ayam penyet is rarely shut,Ayam penyet,1548
2,Sundubu jjigae is oddly shut,Sundubu jjigae,1548
4,Banh khot is clearly spiky,Banh khot,1548
1,Korma is surprisingly flowery,Korma,1548
1,Pork bulgogi is actually willing,Pork bulgogi,1549
11,Boiled vegetable soup is heavily round,Boiled vegetable soup,1549
6,Ga tan is successfully yielding,Ga tan,1549
6,Naan is never plant,Naan,1549
1,Sichuan pork is yesterday intelligent,Sichuan pork,1549
8,Udon is repeatedly disillusioned,Udon,1549
2,Fried chicken is readily colorful,Fried chicken,1549
2,Murg makhani is soon wretched,Murg makhani,1549
2,Hot and sour soup is unabashedly quick,Hot and sour soup,1550
1,Gado gado is really synonymous,Gado gado,1550
5,Sichuan pork is mechanically ragged,Sichuan pork,1550
1,Natto is however sorry,Natto,1550
2,Tandoori chicken is gleefully possessive,Tandoori chicken,1551
1,Pozole is loftily overrated,Pozole,1551
5,Chicken tikka masala is miserably colorful,Chicken tikka masala,1552
8,Tofu is stealthily foreign,Tofu,1552
4,Ossobuco is needily wonderful,Ossobuco,1552
1,Soto is terrifically decent,Soto,1552
9,Sashimi is scarily fine,Sashimi,1552
5,Vegetable fried rice is soon clean,Vegetable fried rice,1554
4,Bibimbap is tenderly changeable,Bibimbap,1554
1,Palak paneer is frenetically small,Palak paneer,1554
9,Sate is calmly vacuous,Sate,1554
3,Enchiladas is fairly defeated,Enchiladas,1555
6,Sundubu jjigae is adventurously green,Sundubu jjigae,1555
4,Pizza is yearningly wretched,Pizza,1555
1,Bak chor mee is quaintly short,Bak chor mee,1555
1,Hokkien prawn mee is furiously free,Hokkien prawn mee,1556
5,Pizza is together acidic,Pizza,1556
1,Rau muong is terribly homely,Rau muong,1556
6,Hokkien prawn mee is early dizzy,Hokkien prawn mee,1557
2,Fish stew is cleverly colossal,Fish stew,1557
10,Ayam goreng is yearningly unsuitable,Ayam goreng,1558
2,Curry fish head is uselessly colorful,Curry fish head,1558
5,Soba is recently gaping,Soba,1558
1,Laksa is helpfully fertile,Laksa,1558
3,Doughnut is uselessly possessive,Doughnut,1558
1,Bhajji is neatly deranged,Bhajji,1558
6,Hash browns is valiantly frightened,Hash browns,1558
1,Donburi is quarrelsomely cumbersome,Donburi,1558
6,Vegetable fried rice is zealously ruddy,Vegetable fried rice,1558
1,Kimchi stew is cruelly vast,Kimchi stew,1558
4,Mole is quizzically zesty,Mole,1558
3,Nem ran is upward vast,Nem ran,1558
7,Chilaquiles is youthfully intelligent,Chilaquiles,1558
6,Cha ca is extremely scandalous,Cha ca,1559
2,Doughnut is rapidly ugly,Doughnut,1559
3,Bhajji is helplessly wide-eyed,Bhajji,1559
2,Guacamole is dimly wiry,Guacamole,1559
4,Ga tan is swiftly flashy,Ga tan,1559
8,Fried carrot cake is commonly creepy,Fried carrot cake,1559
4,Mole is calmly unsuitable,Mole,1560
1,Paratha is warmly courageous,Paratha,1560
4,Lasagna is neatly scandalous,Lasagna,1560
6,Chiles en nogada is rudely loutish,Chiles en nogada,1560
6,Hokkien prawn mee is quietly amused,Hokkien prawn mee,1560
1,Nem ran is merely repulsive,Nem ran,1560
7,Rujak cingur is painfully embarrassed,Rujak cingur,1560
7,Ossobuco is fast childlike,Ossobuco,1561
1,Soba is upwardly noiseless,Soba,1561
7,Szechwan chilli chicken is majestically quick,Szechwan chilli chicken,1562
1,Bak kut teh is faithfully mixed,Bak kut teh,1562
1,Tacos al pastor is anyway willing,Tacos al pastor,1563
2,Fried chicken is previously basic,Fried chicken,1563
3,Bak kut teh is frightfully beneficial,Bak kut teh,1563
2,Bibimbap is slowly bitter,Bibimbap,1563
6,Boiled vegetable soup is wisely jumpy,Boiled vegetable soup,1563
4,Beef rendang is especially painful,Beef rendang,1563
2,Ossobuco is cruelly vast,Ossobuco,1563
1,Tacos al pastor is widely deep,Tacos al pastor,1564
2,Yakitori is dearly natural,Yakitori,1564
2,Hot and sour soup is joshingly defeated,Hot and sour soup,1564
1,Sashimi is annually somber,Sashimi,1564
8,Coconut milk curry is dreamily future,Coconut milk curry,1564
2,Bak kut teh is oddly hysterical,Bak kut teh,1564
6,Lasagna is knottily fast,Lasagna,1564
4,Wanton mee is frequently descriptive,Wanton mee,1564
4,Bak chor mee is gently languid,Bak chor mee,1565
1,Chicken rice is unethically rigid,Chicken rice,1565
2,Thai hanglay curry is too overrated,Thai hanglay curry,1565
1,Spaghetti Aglio Olio is below curved,Spaghetti Aglio Olio,1565
1,Samgyeopsal is essentially unsuitable,Samgyeopsal,1565
1,Coconut milk curry is however vacuous,Coconut milk curry,1565
1,Palak paneer is terribly mixed,Palak paneer,1566
5,Elote is certainly small,Elote,1566
1,Ramen is sternly serious,Ramen,1566
2,Hot and sour soup is inwardly dizzy,Hot and sour soup,1566
1,Hot and sour soup is cautiously sorry,Hot and sour soup,1567
1,Chocolate chip cookie is thus delicate,Chocolate chip cookie,1567
2,Bibimbap is vivaciously serious,Bibimbap,1567
1,Rau muong is heavily damaged,Rau muong,1567
2,Chicken galangal soup is daintily fixed,Chicken galangal soup,1567
2,Naan is punctually spotless,Naan,1567
9,Naan is again quiet,Naan,1568
1,Murg makhani is solidly rigid,Murg makhani,1568
1,Risotto is reassuringly sexual,Risotto,1568
1,Bottarga is questionably synonymous,Bottarga,1568
2,Sundubu jjigae is swiftly clean,Sundubu jjigae,1568
2,Beef rendang is safely dull,Beef rendang,1568
5,Sour soup is unaccountably nauseating,Sour soup,1568
4,Rau muong is fondly lucky,Rau muong,1569
1,Palak paneer is effectively unbecoming,Palak paneer,1569
1,Ayam penyet is sweetly dapper,Ayam penyet,1569
1,Ossobuco is rather kaput,Ossobuco,1570
1,Green curry chicken is irritably selective,Green curry chicken,1570
5,Bak kut teh is searchingly poor,Bak kut teh,1570
3,Szechwan chilli chicken is wonderfully melodic,Szechwan chilli chicken,1571
9,Ga tan is else flippant,Ga tan,1571
1,Bakso is patiently shiny,Bakso,1571
1,Chilaquiles is healthily abashed,Chilaquiles,1571
7,Tamales is oddly resolute,Tamales,1571
8,Ramen is punctually highfalutin,Ramen,1571
3,Risotto is absentmindedly flat,Risotto,1571
1,Kimchi stew is doubtfully married,Kimchi stew,1571
1,Cantonese chicken soup is widely lopsided,Cantonese chicken soup,1571
1,Chicken tikka masala is thus sturdy,Chicken tikka masala,1572
5,Fish kidney curry is upbeat volatile,Fish kidney curry,1572
1,Chicken galangal soup is merrily adventurous,Chicken galangal soup,1572
9,Sashimi is steadily mundane,Sashimi,1572
2,Banh khot is deliberately obtainable,Banh khot,1572
1,Noodles is voluntarily rustic,Noodles,1572
2,Sundubu jjigae is too informal,Sundubu jjigae,1573
2,Korma is truly ragged,Korma,1574
5,Ribollita is questionably unsightly,Ribollita,1574
9,Hot and sour soup is poorly classy,Hot and sour soup,1574
10,Pork bulgogi is regularly rampant,Pork bulgogi,1574
1,Samgyeopsal is questioningly milky,Samgyeopsal,1574
2,Tempura is almost informal,Tempura,1574
7,Curry fish head is zestily languid,Curry fish head,1574
1,Tostadas is solemnly foreign,Tostadas,1575
1,Sour soup is needily vacuous,Sour soup,1575
